year,reporter,trade_flow,partner,hs_code,commodity,unit_type,quantity,net_weight,cif_value,fob_value
2023,Paraguay,imported_from,Brazil,840490,"Boilers; parts of auxiliary plant, for use with boilers of heading no. 8402 and 8403 and parts of condensers for steam or other vapour power units",kg,168824.61,168824.61,1801591.4,1734756.73
2023,Paraguay,imported_from,Brazil,840510,"Generators; producer gas, water gas, acetylene gas and similar water process gas generators, with or without their purifiers",kg,501.654,501.654,4777.72,4708.63
2023,Paraguay,imported_from,Brazil,840590,"Generators; parts of producer gas, water gas, acetylene gas and similar water process gas generators, with or without their purifiers",kg,8.0,8.0,207.32,204.55
2023,Paraguay,imported_from,Brazil,840682,"Turbines; steam and other vapour turbines, (for other than marine propulsion), of an output not exceeding 40MW",,0.0,40582.0,1351691.41,1325041.0
2023,Paraguay,imported_from,Brazil,840690,Turbines; parts of steam and other vapour turbines,kg,31015.462,31015.462,29938.32,27939.11
2023,Paraguay,imported_from,Brazil,840721,"Engines; outboard motors for marine propulsion, spark-ignition reciprocating or rotary internal combustion piston engines",units,2.995,2450.55,12128.94,11547.42
2023,Paraguay,imported_from,Brazil,840733,"Engines; reciprocating piston engines, of a kind used for the propulsion of vehicles of chapter 87, of a cylinder capacity exceeding 250cc but not exceeding 1000cc",units,4.72,1783.42,8212.42,7657.36
2023,Paraguay,imported_from,Brazil,840734,"Engines; reciprocating piston engines, of a kind used for the propulsion of vehicles of chapter 87, of a cylinder capacity exceeding 1000cc",units,50.384,4600.68,131794.05,122012.43
2023,Paraguay,imported_from,Brazil,840790,"Engines; rotary internal combustion piston engines, for other than aircraft or marine propulsion",,0.0,4608.61,47218.01,46643.36
2023,Paraguay,imported_from,Brazil,840810,"Engines; for marine propulsion, compression-ignition internal combustion piston engines (diesel or semi-diesel engines)",,0.0,2350.0,39220.85,38392.27
2023,Paraguay,imported_from,Brazil,840820,"Engines; compression-ignition internal combustion piston engines (diesel or semi-diesel engines), of a kind used for the propulsion of vehicles of chapter 87",,0.0,6815.73,177680.21,171424.24
2023,Paraguay,imported_from,Brazil,840890,"Engines; compression-ignition internal combustion piston engines (diesel or semi-diesel engines), of a kind used for other than marine propulsion or the vehicles of chapter 87",units,25.995,4091.68,314635.58,307405.57
2023,Paraguay,imported_from,Brazil,840910,Engines; parts of aircraft engines (spark-ignition reciprocating or rotary internal combustion piston engines),kg,2.5,2.5,4860.7,4535.35
2023,Paraguay,imported_from,Brazil,840991,"Engines; parts, suitable for use solely or principally with spark-ignition internal combustion piston engines (for other than aircraft)",kg,49123.865,49123.865,1152125.38,1121561.42
2023,Paraguay,imported_from,Brazil,840999,Engines; parts for internal combustion piston engines (excluding spark-ignition),kg,262960.55,262960.55,5389052.54,5256553.29
2023,Paraguay,imported_from,Brazil,841011,"Turbines; hydraulic turbines and water wheels, of a power not exceeding 1000kW",,0.0,300.0,413.7,409.61
2023,Paraguay,imported_from,Brazil,841013,"Turbines; hydraulic turbines and water wheels, of a power exceeding 10000kW",,0.0,35676.0,124116.98,116985.7
2023,Paraguay,imported_from,Brazil,841191,Turbines; parts of turbo-jets and turbo-propellers,kg,5.0,5.0,140.38,138.72
2023,Paraguay,imported_from,Brazil,841221,"Engines; hydraulic power engines and motors, linear acting (cylinders)",,0.0,46393.23,976110.46,944682.6
2023,Paraguay,imported_from,Brazil,841229,"Engines; hydraulic power engines and motors, other than linear acting (cylinders)",,0.0,5483.29,289555.953,279520.61
2023,Paraguay,imported_from,Brazil,841231,"Engines; pneumatic power engines and motors, linear acting (cylinders)",,0.0,7875.075,327172.33,316157.68
2023,Paraguay,imported_from,Brazil,841239,"Engines; pneumatic power engines and motors, other than linear acting (cylinders)",,0.0,880.54,48912.26,46522.54
2023,Paraguay,imported_from,Brazil,841280,"Engines; pneumatic power engines and motors, n.e.c. in heading no. 8412",,0.0,26.2,12098.88,11912.66
2023,Paraguay,imported_from,Brazil,841290,"Engines; parts, for engines and motors of heading no. 8412",kg,7820.437,7820.437,232193.79,224186.11
2023,Paraguay,imported_from,Brazil,841311,"Pumps; fitted or designed to be fitted with a measuring device, for dispensing fuel or lubricants, of the type used in filling-stations or in garages",,0.0,145327.0,4014580.28,3880597.12
2023,Paraguay,imported_from,Brazil,841319,"Pumps; for liquids, fitted or designed to be fitted with a measuring device, other than pumps for dispensing fuel or lubricants",,0.0,295.324,8410.56,7743.08
2023,Paraguay,imported_from,Brazil,841320,"Pumps; hand, fitted or designed to be fitted with a measuring device, for liquids, other than those of item no. 8413.11 or 8413.19",,0.0,4525.7,117094.01,113516.5
2023,Paraguay,imported_from,Brazil,841330,"Pumps; fuel, lubricating or cooling medium pumps for internal combustion piston engines",,0.0,117281.883,2104354.772,2037836.46
2023,Paraguay,imported_from,Brazil,841350,"Pumps; reciprocating positive displacement pumps, n.e.c. in heading no. 8413, for liquids",,0.0,10412.48,379633.96,365087.39
2023,Paraguay,imported_from,Brazil,841360,"Pumps; rotary positive displacement pumps, n.e.c. in heading no. 8413, for liquids",,0.0,72966.322,1721505.57,1677650.56
2023,Paraguay,imported_from,Brazil,841370,"Pumps; centrifugal, n.e.c. in heading no. 8413, for liquids",,0.0,229219.32,3603426.54,3486306.23
2023,Paraguay,imported_from,Brazil,841381,Pumps and liquid elevators; n.e.c. in heading no. 8413,,0.0,51325.291,610807.44,594639.59
2023,Paraguay,imported_from,Brazil,841382,Liquid elevators,,0.0,251.95,7341.59,7122.75
2023,Paraguay,imported_from,Brazil,841391,Pumps; parts thereof,kg,61672.411,61672.411,1520537.494,1458878.27
2023,Paraguay,imported_from,Brazil,841392,Liquid elevators; parts thereof,kg,873.201,873.201,6742.9,6589.2
2023,Paraguay,imported_from,Brazil,841410,Pumps; vacuum,,0.0,4432.59,202402.82,195831.34
2023,Paraguay,imported_from,Brazil,841420,Pumps; hand or foot-operated air pumps,units,2675.802,1520.6,11306.59,10838.87
2023,Paraguay,imported_from,Brazil,841430,Compressors; of a kind used in refrigerating equipment,,0.0,240407.109,2144173.34,2064330.98
2023,Paraguay,imported_from,Brazil,841440,Compressors; air compressors mounted on a wheeled chassis for towing,,0.0,787.0,18199.8,17488.2
2023,Paraguay,imported_from,Brazil,841451,"Fans; table, floor, wall, window, ceiling or roof fans, with a self-contained electric motor of an output not exceeding 125W",units,2365.428,8149.79,70202.57,67828.14
2023,Paraguay,imported_from,Brazil,841459,Fans; n.e.c. in item no. 8414.51,,0.0,281145.805,2453122.83,2339942.41
2023,Paraguay,imported_from,Brazil,841460,"Hoods; ventilating or recycling hoods incorporating a fan, whether or not fitted with filters, having a maximum horizontal side not exceeding 120cm",units,1118.999,22396.5,132091.85,127152.73
2023,Paraguay,imported_from,Brazil,841480,"Pumps and compressors; for air, vacuum or gas, n.e.c. in heading no. 8414",,0.0,295893.467,4390269.424,4244183.05
2023,Paraguay,imported_from,Brazil,841490,"Pumps and compressors; parts, of air or vacuum pumps, air or other gas compressors and fans, ventilating or recycling hoods incorporating a fan",kg,55713.329,55713.329,1031523.06,997323.52
2023,Paraguay,imported_from,Brazil,841510,"Air conditioning machines; comprising a motor-driven fan and elements for changing the temperature and humidity, of a kind designed to be fixed to a window, wall, ceiling or floor, self-contained or 'split-system'",units,45.902,425.25,14862.34,11195.08
2023,Paraguay,imported_from,Brazil,841520,"Air conditioning machines; comprising a motor driven fan and elements for changing the temperature and humidity, of a kind used for persons, in motor vehicles",,0.0,295.43,23683.58,21673.63
2023,Paraguay,imported_from,Brazil,841581,"Air conditioning machines; containing a motor driven fan, other than window or wall types, incorporating a refrigerating unit and a valve for reversal of the cooling/heat cycle (reversible heat pumps)",,0.0,101.16,399.51,394.87
2023,Paraguay,imported_from,Brazil,841582,"Air conditioning machines; containing a motor driven fan, other than window or wall types, incorporating a refrigerating unit",,0.0,10198.8,109050.13,107192.46
2023,Paraguay,imported_from,Brazil,841590,"Air conditioning machines; with motor driven fan and elements for temperature control, parts thereof",kg,6445.11,6445.11,150356.19,143352.27
2023,Paraguay,imported_from,Brazil,841610,"Furnaces; furnace burners, for liquid fuel",kg,16.16,16.16,924.74,823.14
2023,Paraguay,imported_from,Brazil,841620,"Furnaces; furnace burners, for pulverized solid fuel or gas, including combination burners",kg,2506.56,2506.56,172847.67,166373.57
2023,Paraguay,imported_from,Brazil,841630,"Furnace accessories; mechanical stokers, mechanical grates, mechanical ash dischargers and similar appliances",kg,296564.0,296564.0,1611464.1,1562318.16
2023,Paraguay,imported_from,Brazil,841690,"Furnaces; parts of furnace burners, for liquid fuel, pulverized solid fuel or gas, mechanical stokers, grates, ash dischargers and the like",kg,29705.1,29705.1,256974.8,250076.58
2023,Paraguay,imported_from,Brazil,841710,"Furnaces and ovens; non-electric, for the roasting, melting or other heat-treatment of ores, pyrites or of metals, for industrial or laboratory use",,0.0,29972.63,166615.41,162545.09
2023,Paraguay,imported_from,Brazil,841720,"Ovens; non-electric, bakery ovens, including biscuit ovens",units,5.96,35121.1,80787.18,77290.13
2023,Paraguay,imported_from,Brazil,841780,"Furnaces and ovens; including incinerators, non-electric, for industrial or laboratory use, n.e.c. in heading no. 8417",,0.0,423770.0,292859.24,259067.11
2023,Paraguay,imported_from,Brazil,841790,"Furnaces and ovens; parts of non-electric furnaces and ovens (including incinerators), of industrial or laboratory use",kg,9609.3,9609.3,28705.37,25613.26
2023,Paraguay,imported_from,Brazil,841810,"Refrigerators and freezers; combined refrigerator-freezers, fitted with separate external doors, electric or other",units,29356.301,2040820.5,11710623.76,11021256.21
2023,Paraguay,imported_from,Brazil,841821,"Refrigerators; for household use, compression-type, electric or other",units,9131.292,443675.0,2448108.04,2322153.4
2023,Paraguay,imported_from,Brazil,841830,"Freezers; of the chest type, not exceeding 800l capacity",units,18764.897,745553.0,4004258.81,3754884.9
2023,Paraguay,imported_from,Brazil,841840,"Freezers; of the upright type, not exceeding 900l capacity",units,2278.993,157483.0,868263.34,828869.7
2023,Paraguay,imported_from,Brazil,841850,"Furniture incorporating refrigerating or freezing equipment; for storage and display, n.e.c. in item no. 8418.1, 8418.2, 8418.3 or 8418.4 (chests, cabinets, display counters, show-cases and the like)",units,8490.485,1336339.5,9629525.51,8982811.86
2023,Paraguay,imported_from,Brazil,841861,Heat pumps; other than air conditioning machines of heading no. 8415,,0.0,5917.7,78020.55,74709.59
2023,Paraguay,imported_from,Brazil,841869,Refrigerating or freezing equipment; n.e.c. in heading no. 8418,kg,272385.1,272385.1,4524623.23,4385109.79
2023,Paraguay,imported_from,Brazil,841891,"Refrigerating or freezing equipment; parts, furniture designed to receive refrigerating or freezing equipment",kg,15871.5,15871.5,252425.64,240443.52
2023,Paraguay,imported_from,Brazil,841899,"Refrigerating or freezing equipment; parts thereof, other than furniture",kg,163661.2,163661.2,2118077.58,2020147.59
2023,Paraguay,imported_from,Brazil,841911,"Heaters; instantaneous gas water heaters, for domestic or other purposes",units,24.118,1294.12,7598.26,7204.57
2023,Paraguay,imported_from,Brazil,841912,"Heaters; solar water heaters, non-electric",units,35.377,775.0,6905.58,5868.62
2023,Paraguay,imported_from,Brazil,841919,"Heaters; instantaneous or storage water heaters, non-electric, (other than instantaneous gas or solar water heaters)",units,26.995,660.0,14940.34,13450.66
2023,Paraguay,imported_from,Brazil,841920,"Sterilizers; for medical, surgical or laboratory use, not used for domestic purposes",,0.0,1373.37,39983.51,38560.64
2023,Paraguay,imported_from,Brazil,841934,"Dryers; for agricultural products, not used for domestic purposes",,0.0,1261860.0,5720612.77,5493507.54
2023,Paraguay,imported_from,Brazil,841935,"Dryers; for wood, paper pulp, paper or paperboard, not used for domestic purposes",,0.0,375140.0,390003.49,350171.94
2023,Paraguay,imported_from,Brazil,841939,"Dryers; for products n.e.c. in heading no. 8419, not used for domestic purposes",,0.0,117423.0,1211715.45,1170232.04
2023,Paraguay,imported_from,Brazil,841940,Distilling or rectifying plant; not used for domestic purposes,,0.0,866.71,46577.26,43826.81
2023,Paraguay,imported_from,Brazil,841950,Heat exchange units; not used for domestic purposes,,0.0,219167.56,2845342.45,2731163.14
2023,Paraguay,imported_from,Brazil,841960,"Machinery; for liquefying air or gas, not used for domestic purposes",,0.0,11320.1,179544.64,169104.15
2023,Paraguay,imported_from,Brazil,841981,"Machinery, plant and equipment; for making hot drinks, for cooking or heating food",,0.0,168238.06,1456941.96,1397577.62
2023,Paraguay,imported_from,Brazil,841989,"Machinery, plant and laboratory equipment; for treating materials by change of temperature, other than for making hot drinks or cooking or heating food",,0.0,212917.46,2324264.313,2207011.96
2023,Paraguay,imported_from,Brazil,841990,"Machinery, plant and laboratory equipment; parts of equipment for treating materials by a process involving a change of temperature",kg,199588.3,199588.3,2482392.84,2411026.44
2023,Paraguay,imported_from,Brazil,842010,"Machines; calendering or other rolling machines, for other than metal or glass",,0.0,11453.07,115627.86,111404.99
2023,Paraguay,imported_from,Brazil,842091,"Machines; parts, cylinders for calendering or other rolling machines, for other than metal or glass",kg,4419.06,4419.06,113639.31,111103.26
2023,Paraguay,imported_from,Brazil,842099,"Machines; parts, (other than cylinders), for calendering or other rolling machines, for other than metal or glass",kg,23.66,23.66,8582.07,7824.55
2023,Paraguay,imported_from,Brazil,842112,Centrifuges; clothes-dryers,units,10616.566,369285.0,2644540.62,2475199.42
2023,Paraguay,imported_from,Brazil,842119,"Centrifuges; n.e.c. in heading no. 8421, including centrifugal dryers (but not clothes-dryers)",,0.0,832.664,99382.2,97184.8
2023,Paraguay,imported_from,Brazil,842121,Machinery; for filtering or purifying water,,0.0,165599.0,1505138.3,1427024.52
2023,Paraguay,imported_from,Brazil,842122,Machinery; for filtering or purifying beverages other than water,,0.0,800.0,7534.79,6976.0
2023,Paraguay,imported_from,Brazil,842123,"Machinery; filtering or purifying machinery, oil or petrol filters for internal combustion engines",,0.0,294303.68,4328109.126,4179725.75
2023,Paraguay,imported_from,Brazil,842129,"Machinery; for filtering or purifying liquids, n.e.c. in item no. 8421.2",,0.0,70765.06,1407654.05,1348566.36
2023,Paraguay,imported_from,Brazil,842131,Machinery; intake air filters for internal combustion engines,units,53929.277,26364.66,956880.28,921208.28
2023,Paraguay,imported_from,Brazil,842132,"Machinery; catalytic converters or particulate filters, whether or not combined, for purifying or filtering exhaust gases from internal combustion engines",,0.0,326.16,11393.23,10624.44
2023,Paraguay,imported_from,Brazil,842139,"Machinery; for filtering or purifying gases, other than intake air filters, catalytic converters or particulate filters for internal combustion engines",,0.0,416923.023,4128400.36,3945204.02
2023,Paraguay,imported_from,Brazil,842191,"Centrifuges; parts thereof, including parts for centrifugal dryers",kg,939.854,939.854,59705.27,57315.65
2023,Paraguay,imported_from,Brazil,842199,Machinery; parts for filtering or purifying liquids or gases,kg,355878.706,355878.706,5324024.606,5102671.26
2023,Paraguay,imported_from,Brazil,842220,Machinery; for cleaning or drying bottles or other containers,,0.0,3631.08,102608.4,99353.52
2023,Paraguay,imported_from,Brazil,842230,"Machinery; for filling, closing, sealing, capsuling or labelling bottles, cans, bags or other containers, machinery for aerating beverages",,0.0,32295.71,1144197.93,1108846.47
2023,Paraguay,imported_from,Brazil,842240,Machinery; for packing or wrapping,,0.0,40872.5,1517403.7,1473777.11
2023,Paraguay,imported_from,Brazil,842290,Machinery; parts of machinery of heading no. 8422,kg,5895.06,5895.06,595626.406,571209.66
2023,Paraguay,imported_from,Brazil,842330,"Weighing machines; constant weight scales and scales for discharging a predetermined weight of material into a bag or container, including hopper scales",,0.0,38871.43,970522.96,946642.01
2023,Paraguay,imported_from,Brazil,842381,"Weighing machines; other than personal, conveyor or constant weight scales, having a maximum weighing capacity not exceeding 30kg (excluding balances of a sensitivity of 5cg or better)",,0.0,71.6,4388.87,4152.53
2023,Paraguay,imported_from,Brazil,842382,"Weighing machines; other than personal, conveyor or constant weight scales, having a maximum weighing capacity exceeding 30kg but not exceeding 5000kg",,0.0,6100.0,147544.7,141837.31
2023,Paraguay,imported_from,Brazil,842389,"Weighing machines; other than personal, conveyor or constant weight scales, having a maximum weighing capacity exceeding 5000kg",,0.0,15678.8,85329.51,79963.31
2023,Paraguay,imported_from,Brazil,842390,"Weighing machines; weights of all kinds, parts of weighing machinery",kg,8907.68,8907.68,241592.11,233146.68
2023,Paraguay,imported_from,Brazil,842410,Fire extinguishers; whether or not charged,,0.0,4250.5,25259.5,23700.0
2023,Paraguay,imported_from,Brazil,842420,Spray guns and similar appliances,,0.0,5987.61,69378.86,67502.32
2023,Paraguay,imported_from,Brazil,842430,Mechanical appliances; steam or sand blasting machines and similar jet projecting machines,,0.0,136110.1,1895646.15,1837826.35
2023,Paraguay,imported_from,Brazil,842441,Mechanical appliances; agricultural or horticultural sprayers; portable sprayers,,0.0,76003.5,1069666.39,1038813.82
2023,Paraguay,imported_from,Brazil,842449,Mechanical appliances; agricultural or horticultural sprayers; other than portable sprayers,,0.0,2784720.0,59420969.7,58362887.05
2023,Paraguay,imported_from,Brazil,842482,"Mechanical appliances; agricultural or horticultural, n.e.c. in heading 8424",,0.0,521412.5,4187705.03,4053225.05
2023,Paraguay,imported_from,Brazil,842489,"Mechanical appliances; for projecting, dispersing or spraying liquids or powders, for other than agricultural or horticultural use, whether or not hand-operated",,0.0,17197.96,406545.706,394302.22
2023,Paraguay,imported_from,Brazil,842490,"Mechanical appliances; parts of machines projecting, dispersing or spraying liquids or powders, whether or not hand-operated",kg,168336.51,168336.51,4187687.032,4066443.41
2023,Paraguay,imported_from,Brazil,842511,Pulley tackle and hoists; powered by an electric motor (excluding skip hoists or hoists of a kind used for raising vehicles),,0.0,1117.28,15591.78,14593.49
2023,Paraguay,imported_from,Brazil,842519,Pulley tackle and hoists; not powered by an electric motor (excluding skip hoists or hoists of a kind used for raising vehicles),,0.0,1457.12,31122.27,29992.76
2023,Paraguay,imported_from,Brazil,842531,Winches; capstans; powered by an electric motor,,0.0,1600.51,9832.93,9683.34
2023,Paraguay,imported_from,Brazil,842539,Winches; capstans; not powered by an electric motor,,0.0,19874.43,109953.14,104319.89
2023,Paraguay,imported_from,Brazil,842541,"Jacks; built-in jacking systems of a type used in garages, for raising vehicles",units,12.453,6523.0,30110.7,27912.51
2023,Paraguay,imported_from,Brazil,842542,"Jacks and hoists; hydraulic, of a kind used for raising vehicles",,0.0,126725.81,654347.311,630696.28
2023,Paraguay,imported_from,Brazil,842549,"Jacks and hoists; (other than hydraulic), of a kind used for raising vehicles",,0.0,51220.054,272536.35,265153.03
2023,Paraguay,imported_from,Brazil,842611,Cranes; overhead travelling cranes on fixed support,units,29.669,99641.2,902689.74,834365.52
2023,Paraguay,imported_from,Brazil,842619,"Cranes; transporter, gantry and bridge cranes",,0.0,190.2,1258.32,1242.44
2023,Paraguay,imported_from,Brazil,842620,Cranes; tower cranes,units,0.038,17.86,4490.33,4341.23
2023,Paraguay,imported_from,Brazil,842691,Cranes and derricks; designed for mounting on road vehicles,units,5.482,18576.3,186773.85,178385.0
2023,Paraguay,imported_from,Brazil,842699,"Cranes and derricks; for other than mounting on road vehicles, n.e.c. in heading no. 8426",,0.0,22721.4,283341.71,276883.88
2023,Paraguay,imported_from,Brazil,842710,"Fork-lift and other works trucks; fitted with lifting or handling equipment, self-propelled by electric motor",units,27.7,94852.5,489309.22,466583.95
2023,Paraguay,imported_from,Brazil,842720,"Fork-lift and other works trucks; fitted with lifting or handling equipment, self-propelled by other than electric motor",units,0.186,5380.0,7400.45,7115.82
2023,Paraguay,imported_from,Brazil,842790,"Fork-lift and other works trucks; fitted with lifting or handling equipment, not self-propelled",,0.0,66269.1,336417.63,319516.81
2023,Paraguay,imported_from,Brazil,842810,Lifts and skip hoists,units,131.164,529308.02,2610380.46,2451510.36
2023,Paraguay,imported_from,Brazil,842820,Elevators and conveyors; pneumatic,,0.0,58776.6,454071.68,435411.33
2023,Paraguay,imported_from,Brazil,842832,"Elevators and conveyors; continuous-action, for goods or materials, bucket type, n.e.c. in item no. 8428.20 or 8428.31",units,195.648,1029110.0,4827128.22,4622889.73
2023,Paraguay,imported_from,Brazil,842833,"Elevators and conveyors; continuous-action, for goods or materials, belt type, n.e.c. in item no. 8428.20 or 8428.31",,0.0,221668.0,1217019.9,1167011.49
2023,Paraguay,imported_from,Brazil,842839,"Elevators and conveyors; continuous-action, for goods or materials, n.e.c. in item no. 8428.20, 8428.31, 8428.32 or 8428.33",,0.0,1112928.0,7725676.63,7444173.85
2023,Paraguay,imported_from,Brazil,842890,"Lifting, handling, loading or unloading machinery; n.e.c. in heading no. 8425, 8426, 8427 or 8428",,0.0,14344.2,79047.52,73439.35
2023,Paraguay,imported_from,Brazil,842911,"Bulldozers and angledozers; self-propelled, track laying",units,20.335,270205.0,3553459.73,3487224.28
2023,Paraguay,imported_from,Brazil,842919,"Bulldozers and angledozers; self-propelled, other than track laying",units,2.335,20714.0,142090.0,136920.0
2023,Paraguay,imported_from,Brazil,842920,Graders and levellers,units,20.471,209088.0,2696019.81,2643277.82
2023,Paraguay,imported_from,Brazil,842940,Tamping machines and road rollers; self-propelled,units,4.93,18490.0,213789.44,211498.68
2023,Paraguay,imported_from,Brazil,842951,Front-end shovel loaders,units,167.881,931599.6,10665299.19,10468202.86
2023,Paraguay,imported_from,Brazil,842952,"Mechanical shovels, excavators and shovel loaders; with a 360 degree revolving super structure",units,240.111,2065524.0,14512970.6,14141781.02
2023,Paraguay,imported_from,Brazil,842959,"Mechanical shovels, excavators and shovel loaders; n.e.c. in item no. 8429.50",units,95.772,522274.09,5523816.75,5417213.45
2023,Paraguay,imported_from,Brazil,843039,Coal or rock cutters and tunnelling machinery; not self-propelled,,0.0,1500.0,2530.77,2473.61
2023,Paraguay,imported_from,Brazil,843041,"Boring or sinking machinery; self-propelled, n.e.c. in heading no. 8430",units,0.695,15721.19,241118.88,232336.07
2023,Paraguay,imported_from,Brazil,843049,Boring and sinking machinery; not self-propelled,,0.0,5128.4,81460.73,79347.05
2023,Paraguay,imported_from,Brazil,843061,"Machinery; for tamping or compacting, not self-propelled",units,18.38,2353.0,39388.18,37235.82
2023,Paraguay,imported_from,Brazil,843069,"Machinery; for moving, levelling, scraping, grading, excavating earth minerals or ores; not self propelled n.e.c in 84.30",,0.0,222713.0,1126481.52,1098887.64
2023,Paraguay,imported_from,Brazil,843110,Machinery; parts of the machinery of heading no. 8425,kg,9202.745,9202.745,34347.09,33547.21
2023,Paraguay,imported_from,Brazil,843120,Machinery; parts of the machinery of heading no. 8427,kg,10602.307,10602.307,159736.286,147339.28
2023,Paraguay,imported_from,Brazil,843131,"Lifts, skip hoists or escalators; parts thereof",kg,171718.09,171718.09,928280.137,889855.8
2023,Paraguay,imported_from,Brazil,843139,"Machinery; parts of the machinery of heading no. 8428, (other than lifts, skip hoists or escalators)",kg,386989.98,386989.98,2411635.207,2330430.35
2023,Paraguay,imported_from,Brazil,843141,"Machinery parts; buckets, shovels, grabs and grips, for the machinery of heading no. 8426 and 8430",kg,5771.04,5771.04,108286.46,105254.07
2023,Paraguay,imported_from,Brazil,843142,Machinery parts; bulldozer or angledozer blades,kg,11287.1,11287.1,11506.7,11210.35
2023,Paraguay,imported_from,Brazil,843143,Boring or sinking machinery; parts for boring or sinking machinery of subheading 8430.41 or 8430.49,kg,4716.95,4716.95,60210.01,57383.94
2023,Paraguay,imported_from,Brazil,843149,"Machinery; parts of machines handling earth, minerals or ores and n.e.c. in heading no. 8431",kg,252967.537,252967.537,1211818.294,1162049.61
2023,Paraguay,imported_from,Brazil,843210,Ploughs; for soil preparation,units,111.78,422702.0,2053352.66,1994064.59
