year,reporter,trade_flow,partner,hs_code,commodity,unit_type,quantity,net_weight,cif_value,fob_value
2023,Paraguay,imported_from,Brazil,010121,"Horses; live, pure-bred breeding animals",,0.0,8200.0,77783.5,75080.65
2023,Paraguay,imported_from,Brazil,010221,"Cattle; live, pure-bred breeding animals",units,79.701,10925.0,169239.2,163801.19
2023,Paraguay,imported_from,Brazil,010310,"Swine; live, pure-bred breeding animals",,0.0,55587.0,697124.31,649040.72
2023,Paraguay,imported_from,Brazil,010392,"Swine; live, other than pure-bred breeding animals, weighing 50kg or more",units,2690.914,79650.0,655794.51,579105.9
2023,Paraguay,imported_from,Brazil,010511,"Poultry; live, fowls of the species Gallus domesticus, weighing not more than 185g",,0.0,667138.8,11529662.15,10969520.83
2023,Paraguay,imported_from,Brazil,020130,"Meat; of bovine animals, boneless cuts, fresh or chilled",kg,3828180.0,3828180.0,15277210.25,14030355.31
2023,Paraguay,imported_from,Brazil,020220,"Meat; of bovine animals, cuts with bone in (excluding carcasses and half-carcasses), frozen",kg,1845790.0,1845790.0,6557425.64,6235915.96
2023,Paraguay,imported_from,Brazil,020230,"Meat; of bovine animals, boneless cuts, frozen",kg,2261060.0,2261060.0,8534604.6,7973398.84
2023,Paraguay,imported_from,Brazil,020329,"Meat; of swine, n.e.c. in item no. 0203.2, frozen",kg,566554.0,566554.0,1476886.39,1408249.02
2023,Paraguay,imported_from,Brazil,020621,"Offal, edible; of bovine animals, tongues, frozen",kg,207494.0,207494.0,602311.4,548021.3
2023,Paraguay,imported_from,Brazil,020622,"Offal, edible; of bovine animals, livers, frozen",kg,218172.0,218172.0,263605.65,245334.87
2023,Paraguay,imported_from,Brazil,020629,"Offal, edible; of bovine animals, (other than tongues and livers), frozen",kg,262317.5,262317.5,639871.23,567495.84
2023,Paraguay,imported_from,Brazil,020649,"Offal, edible; of swine, (other than livers), frozen",kg,48918.1,48918.1,54241.02,47565.15
2023,Paraguay,imported_from,Brazil,020712,"Meat and edible offal; of fowls of the species Gallus domesticus, not cut in pieces, frozen",kg,2000.0,2000.0,8096.91,8000.0
2023,Paraguay,imported_from,Brazil,020714,"Meat and edible offal; of fowls of the species Gallus domesticus, cuts and offal, frozen",kg,3504.0,3504.0,7924.94,7266.9
2023,Paraguay,imported_from,Brazil,020742,"Meat and edible offal; of ducks, not cut in pieces, frozen",kg,15000.0,15000.0,68185.63,64500.0
2023,Paraguay,imported_from,Brazil,020745,"Meat and edible offal; of ducks, cuts and offal, excluding fatty livers, frozen",kg,2052.0,2052.0,18598.5,17593.2
2023,Paraguay,imported_from,Brazil,021012,"Meat; salted, in brine, dried or smoked, of swine, bellies (streaky) and cuts thereof",kg,67950.0,67950.0,295113.63,291418.73
2023,Paraguay,imported_from,Brazil,021019,"Meat; salted in brine, dried or smoked, of swine, n.e.c. in item no. 0210.1",kg,5120.32,5120.32,44003.58,40640.1
2023,Paraguay,imported_from,Brazil,030389,"Fish; frozen, n.e.c. in heading 0303, excluding fillets, fish meat of 0304, and edible fish offal of subheadings 0303.91 to 0303.99",kg,5400.0,5400.0,11976.13,8590.13
2023,Paraguay,imported_from,Brazil,030461,"Fish fillets; frozen, tilapias (Oreochromis spp.)",kg,4288.0,4288.0,30665.16,28877.6
2023,Paraguay,imported_from,Brazil,040110,"Dairy produce; milk and cream, not concentrated, not containing added sugar or other sweetening matter, of a fat content, by weight, not exceeding 1%",kg,9155.64,9155.64,6092.52,5791.16
2023,Paraguay,imported_from,Brazil,040120,"Dairy produce; milk and cream, not concentrated, not containing added sugar or other sweetening matter, of a fat content, by weight, exceeding 1% but not exceeding 6%",kg,11579.7,11579.7,10807.96,10390.1
2023,Paraguay,imported_from,Brazil,040150,"Dairy produce; milk and cream, not concentrated, not containing added sugar or other sweetening matter, of a fat content, by weight, exceeding 10%",kg,563257.4,563257.4,1247443.08,1198572.05
2023,Paraguay,imported_from,Brazil,040210,"Dairy produce; milk and cream, concentrated or containing added sugar or other sweetening matter, in powder, granules or other solid forms, of a fat content not exceeding 1.5% (by weight)",kg,75000.0,75000.0,257748.12,255000.0
2023,Paraguay,imported_from,Brazil,040221,"Dairy produce; milk and cream, concentrated, not containing added sugar or other sweetening matter, in powder, granules or other solid forms, of a fat content exceeding 1.5% (by weight)",kg,150921.6,150921.6,498276.25,485680.0
2023,Paraguay,imported_from,Brazil,040229,"Dairy produce; milk and cream, containing added sugar or other sweetening matter, in powder, granules or other solid forms, of a fat content exceeding 1.5% (by weight)",kg,23.91,23.91,128.87,9.05
2023,Paraguay,imported_from,Brazil,040299,"Dairy produce; milk and cream, containing added sugar or other sweetening matter, other than in powder, granules or other solid forms",kg,1712910.0,1712910.0,3693506.52,3513623.1
2023,Paraguay,imported_from,Brazil,040320,"Dairy produce; yoghurt, whether or not concentrated or containing added sugar or other sweetening matter or flavoured or containing added fruit, nuts or cocoa",kg,7525.56,7525.56,17341.51,14375.69
2023,Paraguay,imported_from,Brazil,040390,"Dairy produce; buttermilk, curdled milk or cream, kephir, fermented or acidified milk or cream, whether or not concentrated or containing added sweetening, flavouring, fruit, nuts or cocoa (excluding yoghurt)",kg,1412.25,1412.25,2622.25,2154.26
2023,Paraguay,imported_from,Brazil,040410,"Dairy produce; whey, whether or not concentrated or containing added sugar or other sweetening matter",kg,325439.0,325439.0,317269.16,287731.57
2023,Paraguay,imported_from,Brazil,040510,"Dairy produce; derived from milk, butter",kg,9768.0,9768.0,60073.62,55957.16
2023,Paraguay,imported_from,Brazil,040610,"Dairy produce; fresh cheese (including whey cheese), not fermented, and curd",kg,208491.2,208491.2,1079518.77,1021668.3
2023,Paraguay,imported_from,Brazil,040620,"Dairy produce; cheese of all kinds, grated or powdered",kg,567.6,567.6,6341.46,5470.79
2023,Paraguay,imported_from,Brazil,040630,"Dairy produce; cheese, processed (not grated or powdered)",kg,127641.0,127641.0,723271.06,686260.34
2023,Paraguay,imported_from,Brazil,040640,"Dairy produce; cheese, blue-veined and other cheese containing veins produced by Penicillium roqueforti (not grated, powdered or processed)",kg,1710.0,1710.0,15342.1,13797.25
2023,Paraguay,imported_from,Brazil,040690,"Dairy produce; cheese (not grated, powdered or processed), n.e.c. in heading no. 0406",kg,16501.83,16501.83,148803.77,137833.09
2023,Paraguay,imported_from,Brazil,040711,"Birds' eggs, in shell; fresh, fertilised eggs for incubation, of fowls of the species Gallus domesticus (domestic hens)",kg,2117810.0,2117810.0,10685323.95,10239454.49
2023,Paraguay,imported_from,Brazil,040811,"Eggs; birds' eggs, yolks, dried, whether or not containing added sugar or other sweetening matter",kg,1000.0,1000.0,9452.17,8750.0
2023,Paraguay,imported_from,Brazil,040899,"Eggs; birds' eggs (not in shell, excluding yolks only), fresh, cooked by steaming or boiling in water, moulded, frozen, otherwise preserved, whether or not containing added sugar or other sweetening matter",kg,57152.6,57152.6,201820.37,193141.74
2023,Paraguay,imported_from,Brazil,050400,"Animal products; guts, bladders and stomachs of animals (other than fish), whole and pieces thereof, fresh, chilled, frozen, salted, in brine, dried or smoked",kg,3440213.0,3440213.0,7468465.43,6993957.1
2023,Paraguay,imported_from,Brazil,050690,"Animal products; bones and horn-cores and powder or waste of such, unworked, defatted, simply prepared (not cut to shape), or treated with acid or degelatinised, n.e.c. in heading no. 0506",kg,41515.6,41515.6,50815.93,41515.64
2023,Paraguay,imported_from,Brazil,051110,Animal products; bovine semen,kg,215.61,215.61,718393.44,697346.93
2023,Paraguay,imported_from,Brazil,051199,Animal products; n.e.c. in chapter 5,kg,4546653.282,4546653.282,31624021.84,30700518.68
2023,Paraguay,imported_from,Brazil,060210,"Plants, live; unrooted cuttings and slips",units,48614.43,57.52,6158.06,5330.0
2023,Paraguay,imported_from,Brazil,060290,"Plants, live; n.e.c. in heading no. 0602",kg,166642.0,166642.0,111600.76,105619.12
2023,Paraguay,imported_from,Brazil,060311,"Flowers, cut; roses, flowers and buds of a kind suitable for bouquets or ornamental purposes, fresh",kg,6645.0,6645.0,12208.9,12025.95
2023,Paraguay,imported_from,Brazil,060314,"Flowers, cut; chrysanthemums, flowers and buds of a kind suitable for bouquets or ornamental purposes, fresh",kg,54820.0,54820.0,112742.03,111043.55
2023,Paraguay,imported_from,Brazil,060319,"Flowers, cut; flowers and buds of a kind suitable for bouquets or ornamental purposes, fresh, other than roses, carnations, orchids, chrysanthemums or lillies",kg,12827.0,12827.0,24557.89,24187.83
2023,Paraguay,imported_from,Brazil,070190,"Vegetables; potatoes (other than seed), fresh or chilled",kg,4531410.0,4531410.0,347943.0,319539.21
2023,Paraguay,imported_from,Brazil,070200,"Vegetables; tomatoes, fresh or chilled",kg,1042040.0,1042040.0,139510.06,131565.86
2023,Paraguay,imported_from,Brazil,070310,"Vegetables, alliaceous; onions and shallots, fresh or chilled",kg,3186666.0,3186666.0,339492.47,316330.5
2023,Paraguay,imported_from,Brazil,070320,"Vegetables, alliaceous; garlic, fresh or chilled",kg,720.36,720.36,2854.1,2717.16
2023,Paraguay,imported_from,Brazil,070410,"Vegetables, brassica; cauliflowers and broccoli, fresh or chilled",kg,287264.0,287264.0,69298.4,65987.4
2023,Paraguay,imported_from,Brazil,070420,"Vegetables, brassica; brussel sprouts, fresh or chilled",kg,47000.0,47000.0,3382.32,3055.0
2023,Paraguay,imported_from,Brazil,070490,"Vegetables, brassica; edible, n.e.c. in heading no. 0704, fresh or chilled",kg,4835830.0,4835830.0,643280.33,611057.11
2023,Paraguay,imported_from,Brazil,070511,"Vegetables; cabbage (head) lettuce (lactuca sativa), fresh or chilled",kg,85690.0,85690.0,14471.54,13718.9
2023,Paraguay,imported_from,Brazil,070519,"Vegetables; lettuce (lactuca sativa), (other than cabbage lettuce), fresh or chilled",kg,288900.0,288900.0,69877.64,66612.75
2023,Paraguay,imported_from,Brazil,070610,"Vegetables, root; carrots and turnips, fresh or chilled",kg,460501.0,460501.0,71849.8,68516.42
2023,Paraguay,imported_from,Brazil,070690,"Vegetables, root; salad beetroot, salsify, celeric, radishes and similar edible roots, fresh or chilled",kg,2416520.0,2416520.0,350134.91,332756.71
2023,Paraguay,imported_from,Brazil,070700,"Vegetables; cucumbers and gherkins, fresh or chilled",kg,28010.0,28010.0,5901.8,5631.15
2023,Paraguay,imported_from,Brazil,070820,"Vegetables, leguminous; beans (vigna spp., phaseolus spp.), shelled or unshelled, fresh or chilled",kg,4653.0,4653.0,935.93,894.0
2023,Paraguay,imported_from,Brazil,070930,"Vegetables; aubergines, (e.g. plants), fresh or chilled",kg,6615.0,6615.0,1245.59,1180.8
2023,Paraguay,imported_from,Brazil,070940,"Vegetables; celery (other than celeriac), fresh or chilled",kg,2152.0,2152.0,572.02,546.0
2023,Paraguay,imported_from,Brazil,070960,"Vegetables; fruits of the genus capsicum or of the genus pimenta, fresh or chilled",kg,343984.0,343984.0,90801.35,86499.4
2023,Paraguay,imported_from,Brazil,070993,"Vegetables; pumpkins, squash and gourds (Cucurbita spp.), fresh or chilled",kg,898338.0,898338.0,115031.67,108173.22
2023,Paraguay,imported_from,Brazil,070999,"Vegetables; edible, n.e.c. in chapter 07, fresh or chilled",kg,4445248.3,4445248.3,424548.51,387065.09
2023,Paraguay,imported_from,Brazil,071010,"Vegetables; potatoes, uncooked or cooked by steaming or boiling in water, frozen",kg,2500.0,2500.0,154.56,130.0
2023,Paraguay,imported_from,Brazil,071290,"Vegetables; mixtures of vegetables n.e.c. in heading no. 0712, whole, cut, sliced, broken or in powder but not further prepared, dried",kg,80264.13,80264.13,234295.0,221216.2
2023,Paraguay,imported_from,Brazil,071310,"Vegetables, leguminous; peas (pisum sativum), shelled, whether or not skinned or split, dried",kg,210.0,210.0,519.45,505.69
2023,Paraguay,imported_from,Brazil,071320,"Vegetables, leguminous; chickpeas (garbanzos), shelled, whether or not skinned or split, dried",kg,20243.4,20243.4,53994.51,51975.66
2023,Paraguay,imported_from,Brazil,071333,"Vegetables, leguminous; kidney beans, including white pea beans (phaseolus vulgaris), shelled, whether or not skinned or split, dried",kg,203506.52,203506.52,248855.34,237183.75
2023,Paraguay,imported_from,Brazil,071340,"Vegetables, leguminous; lentils, shelled, whether or not skinned or split, dried",kg,36031.8,36031.8,80145.23,76965.83
2023,Paraguay,imported_from,Brazil,071410,"Vegetable roots and tubers; manioc (cassava), with high starch or inulin content, fresh, chilled, frozen or dried, whether or not sliced or in the form of pellets",kg,14000.0,14000.0,2220.25,2100.0
2023,Paraguay,imported_from,Brazil,071420,"Vegetable roots and tubers; sweet potatoes, with high starch or inulin content, fresh, chilled, frozen or dried, whether or not sliced or in the form of pellets",kg,3471430.0,3471430.0,493309.77,468905.08
2023,Paraguay,imported_from,Brazil,080111,"Nuts, edible; coconuts, desiccated",kg,17044.4,17044.4,18875.77,18104.77
2023,Paraguay,imported_from,Brazil,080112,"Nuts, edible; coconuts, in the inner shell (endocarp)",kg,304065.0,304065.0,120897.87,114598.92
2023,Paraguay,imported_from,Brazil,080132,"Nuts, edible; cashew nuts, fresh or dried, shelled",kg,5103.0,5103.0,40873.61,38869.6
2023,Paraguay,imported_from,Brazil,080410,"Fruit, edible; dates, fresh or dried",kg,145949.0,145949.0,14377.39,13877.74
2023,Paraguay,imported_from,Brazil,080430,"Fruit, edible; pineapples, fresh or dried",kg,1070510.0,1070510.0,190049.79,181002.0
2023,Paraguay,imported_from,Brazil,080440,"Fruit, edible; avocados, fresh or dried",kg,678610.0,678610.0,109605.94,104255.1
2023,Paraguay,imported_from,Brazil,080450,"Fruit, edible; guavas, mangoes and mangosteens, fresh or dried",kg,498897.0,498897.0,83451.01,79494.0
2023,Paraguay,imported_from,Brazil,080510,"Fruit, edible; oranges, fresh or dried",kg,2921510.0,2921510.0,410368.49,386673.15
2023,Paraguay,imported_from,Brazil,080521,"Fruit, edible; mandarins (including tangerines and satsumas), fresh or dried",kg,63430.0,63430.0,7614.8,6680.0
2023,Paraguay,imported_from,Brazil,080540,"Fruit, edible; grapefruit and pomelos, fresh or dried",kg,3109.0,3109.0,538.16,513.0
2023,Paraguay,imported_from,Brazil,080550,"Fruit, edible; lemons (Citrus limon, Citrus limonum), limes (Citrus aurantifolia, Citrus latifolia), fresh or dried",kg,2969860.0,2969860.0,473025.59,449050.26
2023,Paraguay,imported_from,Brazil,080610,"Fruit, edible; grapes, fresh",kg,629040.0,629040.0,262522.23,250138.55
2023,Paraguay,imported_from,Brazil,080620,"Fruit, edible; grapes, dried",kg,1560.0,1560.0,5616.32,5429.7
2023,Paraguay,imported_from,Brazil,080711,"Fruit, edible; watermelons, fresh",kg,2130930.0,2130930.0,149520.67,133481.88
2023,Paraguay,imported_from,Brazil,080719,"Fruit, edible; melons, other than watermelons, fresh",kg,418224.0,418224.0,92001.88,87690.6
2023,Paraguay,imported_from,Brazil,080720,"Fruit, edible; papaws (papayas), fresh",kg,1697690.0,1697690.0,291173.29,277154.4
2023,Paraguay,imported_from,Brazil,080810,"Fruit, edible; apples, fresh",kg,135120.0,135120.0,22343.64,21285.9
2023,Paraguay,imported_from,Brazil,080830,"Fruit, edible; pears, fresh",kg,1725.0,1725.0,362.11,345.0
2023,Paraguay,imported_from,Brazil,080930,"Fruit, edible; peaches, including nectarines, fresh",kg,246756.0,246756.0,70680.69,67299.65
2023,Paraguay,imported_from,Brazil,080940,"Fruit, edible; plums and sloes, fresh",kg,402462.0,402462.0,115122.07,109663.8
2023,Paraguay,imported_from,Brazil,081010,"Fruit, edible; strawberries, fresh",kg,37661.0,37661.0,16034.35,15235.2
2023,Paraguay,imported_from,Brazil,081040,"Fruit, edible; cranberries, bilberries and other fruits of the genus vaccinium, fresh",kg,31008.0,31008.0,9000.96,8588.25
2023,Paraguay,imported_from,Brazil,081050,"Fruit, edible; kiwifruit, fresh",kg,394985.0,394985.0,120643.0,114980.95
2023,Paraguay,imported_from,Brazil,081060,"Fruit, edible; durians, fresh",kg,300.0,300.0,42.04,40.0
2023,Paraguay,imported_from,Brazil,081070,"Fruit, edible; persimmons, fresh",kg,9999.0,9999.0,2942.17,2805.3
2023,Paraguay,imported_from,Brazil,081090,"Fruit, edible; fruits n.e.c. in heading no. 0801 to 0810, fresh",kg,329952.0,329952.0,81277.91,77455.8
2023,Paraguay,imported_from,Brazil,081190,"Fruit, edible; fruit and nuts n.e.c. in heading no. 0811, uncooked or cooked, frozen whether or not containing added sugar or other sweetening matter",kg,2214.1,2214.1,11212.24,10804.2
2023,Paraguay,imported_from,Brazil,081320,"Fruit, edible; prunes, dried",kg,864.0,864.0,5449.95,5272.95
2023,Paraguay,imported_from,Brazil,090111,Coffee; not roasted or decaffeinated,kg,633569.08,633569.08,1964349.35,1902127.73
2023,Paraguay,imported_from,Brazil,090121,"Coffee; roasted, not decaffeinated",kg,295089.0,295089.0,2144715.62,2062840.9
2023,Paraguay,imported_from,Brazil,090122,"Coffee; roasted, decaffeinated",kg,4205.4,4205.4,47333.29,45327.09
2023,Paraguay,imported_from,Brazil,090190,"Coffee; husks and skins, coffee substitutes containing coffee in any proportion",kg,5.6,5.6,111.35,68.96
2023,Paraguay,imported_from,Brazil,090300,Mate,kg,117556.66,117556.66,274388.11,265208.19
2023,Paraguay,imported_from,Brazil,090411,"Spices; pepper (of the genus piper), neither crushed nor ground",kg,53500.0,53500.0,184688.82,174020.0
2023,Paraguay,imported_from,Brazil,090412,"Spices; pepper (of the genus piper), crushed or ground",kg,2500.0,2500.0,8900.15,8280.0
2023,Paraguay,imported_from,Brazil,090421,"Spices; fruits of the genus Capsicum or Pimenta, dried, neither crushed nor ground",kg,90.0,90.0,879.47,859.5
2023,Paraguay,imported_from,Brazil,090422,"Spices; fruits of the genus Capsicum or Pimenta, crushed or ground",kg,12850.0,12850.0,29373.67,26718.5
2023,Paraguay,imported_from,Brazil,090620,"Spices; cinnamon and cinnamon-tree flowers, crushed or ground",kg,9200.0,9200.0,33010.18,29855.0
2023,Paraguay,imported_from,Brazil,090710,"Spices; cloves (whole fruit, cloves and stems), neither crushed nor ground",kg,300.0,300.0,3490.01,3363.0
2023,Paraguay,imported_from,Brazil,090811,"Spices; nutmeg, neither crushed nor ground",kg,4.9,4.9,151.68,146.7
2023,Paraguay,imported_from,Brazil,090812,"Spices; nutmeg, crushed or ground",kg,720.0,720.0,11342.11,10671.8
2023,Paraguay,imported_from,Brazil,090931,"Spices; cumin seeds, neither crushed nor ground",kg,500.0,500.0,4869.62,4600.0
2023,Paraguay,imported_from,Brazil,090932,"Spices; cumin seeds, crushed or ground",kg,5000.0,5000.0,13683.54,12760.0
2023,Paraguay,imported_from,Brazil,090961,"Spices; seeds of anise, badian, caraway or fennel; juniper berries, neither crushed nor ground",kg,5000.84,5000.84,16869.85,16201.0
2023,Paraguay,imported_from,Brazil,091020,Spices; saffron,kg,53.2,53.2,371.18,355.05
2023,Paraguay,imported_from,Brazil,091030,Spices; turmeric (curcuma),kg,2000.0,2000.0,4897.15,4420.0
2023,Paraguay,imported_from,Brazil,091099,Spices; n.e.c. in heading no. 0910,kg,700.0,700.0,2433.56,2345.0
2023,Paraguay,imported_from,Brazil,100111,"Cereals; wheat and meslin, durum wheat, seed",kg,200000.0,200000.0,154660.75,139575.0
2023,Paraguay,imported_from,Brazil,100191,"Cereals; wheat and meslin, other than durum wheat, seed",kg,10015.0,10015.0,13196.12,11012.0
2023,Paraguay,imported_from,Brazil,100199,"Cereals; wheat and meslin, other than durum wheat, other than seed",kg,189020.0,189020.0,52990.98,46045.72
2023,Paraguay,imported_from,Brazil,100490,"Cereals; oats, other than seed",kg,175000.0,175000.0,132690.0,119000.0
2023,Paraguay,imported_from,Brazil,100510,"Cereals; maize (corn), seed",kg,18181700.0,18181700.0,109654771.1,106286618.83
2023,Paraguay,imported_from,Brazil,100590,"Cereals; maize (corn), other than seed",kg,747627.4,747627.4,641471.03,600994.84
2023,Paraguay,imported_from,Brazil,100610,Cereals; rice in the husk (paddy or rough),kg,85320.0,85320.0,51664.26,32594.88
2023,Paraguay,imported_from,Brazil,100620,Cereals; husked (brown) rice,kg,252362.0,252362.0,165426.89,130296.47
2023,Paraguay,imported_from,Brazil,100630,"Cereals; rice, semi-milled or wholly milled, whether or not polished or glazed",kg,195162.0,195162.0,171465.99,156677.12
2023,Paraguay,imported_from,Brazil,100640,"Cereals; rice, broken",kg,1.0,1.0,5.62,2.0
2023,Paraguay,imported_from,Brazil,100710,"Cereals; grain sorghum, seed",kg,108177.0,108177.0,610229.81,584386.59
2023,Paraguay,imported_from,Brazil,100821,"Cereals; millet, seed",kg,31260.0,31260.0,94709.49,90759.49
2023,Paraguay,imported_from,Brazil,100830,Cereals; canary seeds,kg,8250.0,8250.0,13455.29,12916.3
2023,Paraguay,imported_from,Brazil,100850,Cereals; quinoa (Chenopodium quinoa),kg,5.4,5.4,38.95,38.33
2023,Paraguay,imported_from,Brazil,100890,Cereals; n.e.c. in chapter 10,kg,37985.0,37985.0,181059.56,176251.15
2023,Paraguay,imported_from,Brazil,110100,Wheat or meslin flour,kg,32100.0,32100.0,16692.51,16050.5
2023,Paraguay,imported_from,Brazil,110220,Cereal flour; of maize (corn),kg,68205.2,68205.2,44097.25,42154.34
2023,Paraguay,imported_from,Brazil,110290,"Cereal flours; other than wheat, meslin, and maize (corn)",kg,4413.2,4413.2,4590.83,4244.57
2023,Paraguay,imported_from,Brazil,110311,Cereal groats and meal; of wheat,kg,300.0,300.0,435.35,423.82
2023,Paraguay,imported_from,Brazil,110313,Cereal groats and meal; of maize (corn),kg,3322050.0,3322050.0,1330386.21,1126111.8
2023,Paraguay,imported_from,Brazil,110412,"Cereal grains; rolled or flaked, of oats",kg,439561.0,439561.0,629198.35,578427.77
2023,Paraguay,imported_from,Brazil,110419,"Cereal grains; rolled or flaked, other than oats",kg,8597.5,8597.5,8139.16,7818.91
2023,Paraguay,imported_from,Brazil,110423,"Cereal grains; worked (e.g. hulled, pearled, sliced or kibbled) of maize (corn)",kg,7092.53,7092.53,9131.08,8844.59
2023,Paraguay,imported_from,Brazil,110429,"Cereal grains; worked, other than rolled or flaked (e.g. Hulled, pearled, sliced or kibbled) of cereals, excluding oats and maize, and rice of heading no.1006",kg,24004.8,24004.8,63536.25,57676.92
2023,Paraguay,imported_from,Brazil,110520,"Flakes, granules and pellets; of potatoes",kg,36432.2,36432.2,157648.29,152991.45
2023,Paraguay,imported_from,Brazil,110620,"Flour, meal and powder; of sago or of roots or tubers of heading no. 0714",kg,56520.9,56520.9,84955.45,81222.14
2023,Paraguay,imported_from,Brazil,110630,"Flour, meal and powder; of the products of chapter 8",kg,6611.59,6611.59,38968.2,36695.91
2023,Paraguay,imported_from,Brazil,110710,Malt; not roasted,kg,23601.0,23601.0,23432.32,21024.81
2023,Paraguay,imported_from,Brazil,110812,Starch; maize (corn) starch,kg,342717.0,342717.0,325616.29,276298.5
2023,Paraguay,imported_from,Brazil,110813,Starch; potato,kg,1.0,1.0,6.01,1.0
2023,Paraguay,imported_from,Brazil,110814,Starch; manioc (cassava),kg,3282572.5,3282572.5,3278896.02,3108413.94
2023,Paraguay,imported_from,Brazil,110820,Inulin,kg,2.5,2.5,35.44,2.0
2023,Paraguay,imported_from,Brazil,120110,"Soya beans; seed, whether or not broken",kg,3408690.0,3408690.0,4545540.71,4199597.19
2023,Paraguay,imported_from,Brazil,120190,"Soya beans; other than seed, whether or not broken",kg,5000002.3,5000002.3,2342075.01,2200011.55
2023,Paraguay,imported_from,Brazil,120230,"Ground-nuts; seed, not roasted or otherwise cooked, whether or not shelled or broken",kg,3.05,3.05,154.26,100.0
2023,Paraguay,imported_from,Brazil,120242,"Ground-nuts; other than seed, not roasted or otherwise cooked, shelled, whether or not broken,",kg,169485.0,169485.0,275412.5,260703.24
2023,Paraguay,imported_from,Brazil,120400,"Oil seeds; linseed, whether or not broken",kg,5.4,5.4,32.33,31.81
2023,Paraguay,imported_from,Brazil,120600,"Oil seeds; sunflower seeds, whether or not broken",kg,26300.0,26300.0,28377.71,27265.4
2023,Paraguay,imported_from,Brazil,120740,"Oil seeds; sesamum seeds, whether or not broken",kg,62101.5,62101.5,101251.92,92530.0
2023,Paraguay,imported_from,Brazil,120770,"Oil seeds; melon seeds, whether or not broken",kg,224.543,224.543,74829.57,73800.45
2023,Paraguay,imported_from,Brazil,120799,"Oil seeds and oleaginous fruits; n.e.c. in heading no. 1207, whether or not broken",kg,5.4,5.4,46.83,46.09
2023,Paraguay,imported_from,Brazil,120810,Flours and meals; of soya beans,kg,70000.0,70000.0,69575.0,62500.0
2023,Paraguay,imported_from,Brazil,120890,Flours and meals of oil seeds or oleaginous fruits; excluding soya beans and mustard seeds,kg,546.0,546.0,1106.56,1060.1
2023,Paraguay,imported_from,Brazil,120922,"Seeds of forage plants; clover (Trifolium spp.) seeds, of a kind used for sowing",kg,8.0,8.0,391.34,48.0
2023,Paraguay,imported_from,Brazil,120925,"Seeds of forage plants; rye grass (Lolium multiflorum Lam., Lolium perenne L.) seeds, of a kind used for sowing",kg,4.0,4.0,65.22,8.0
2023,Paraguay,imported_from,Brazil,120929,"Seeds of forage plants; other than lucerne, clover, fescue, Kentucky blue grass, and rye grass seeds, of a kind used for sowing",kg,1699980.0,1699980.0,6047714.97,5912040.04
2023,Paraguay,imported_from,Brazil,120991,"Seeds; vegetable seeds, of a kind used for sowing",kg,11524.2,11524.2,892527.89,863361.91
2023,Paraguay,imported_from,Brazil,120999,"Seeds; n.e.c. in heading 1209, of a kind used for sowing",kg,140.626,140.626,32220.31,31018.05
2023,Paraguay,imported_from,Brazil,121120,"Ginseng roots, of a kind used primarily in perfumery, in pharmacy or for insecticidal, fungicidal or similar purposes, fresh, chilled, frozen or dried, whether or not cut, crushed or powdered",kg,5.0,5.0,42.53,26.45
