year,reporter,trade_flow,partner,hs_code,commodity,unit_type,quantity,net_weight,cif_value,fob_value
2023,Paraguay,imported_from,Brazil,620312,"Suits; men's or boys', of synthetic fibres (not knitted or crocheted)",units,161.608,58.317,7591.51,7353.05
2023,Paraguay,imported_from,Brazil,620319,"Suits; men's or boys', of textile materials n.e.c. in item no. 6203.1 (not knitted or crocheted)",units,6.845,1.964,353.12,335.3
2023,Paraguay,imported_from,Brazil,620322,"Ensembles; men's or boys', of cotton (not knitted or crocheted)",units,6125.056,1798.65,78204.27,76736.34
2023,Paraguay,imported_from,Brazil,620323,"Ensembles; men's or boys', of synthetic fibres (not knitted or crocheted)",units,23366.502,45712.1,331280.05,320883.45
2023,Paraguay,imported_from,Brazil,620329,"Ensembles; men's or boys', of textile materials n.e.c. in item no. 6203.2 (not knitted or crocheted)",,0.0,1041.29,29049.48,27842.14
2023,Paraguay,imported_from,Brazil,620331,"Jackets and blazers; men's or boys', of wool or fine animal hair (not knitted or crocheted)",units,1.287,7.85,122.26,91.5
2023,Paraguay,imported_from,Brazil,620332,"Jackets and blazers; men's or boys', of cotton (not knitted or crocheted)",units,395.489,530.5,13311.62,13039.08
2023,Paraguay,imported_from,Brazil,620333,"Jackets and blazers; men's or boys', of synthetic fibres (not knitted or crocheted)",units,134.289,19.86,4402.41,4273.31
2023,Paraguay,imported_from,Brazil,620339,"Jackets and blazers; men's or boys', of textile materials n.e.c. in item no. 6203.3 (not knitted or crocheted)",units,149.815,65.212,7035.01,6794.15
2023,Paraguay,imported_from,Brazil,620341,"Trousers, bib and brace overalls, breeches and shorts; men's or boys', of wool or fine animal hair (not knitted or crocheted)",units,0.821,2.0,32.75,31.98
2023,Paraguay,imported_from,Brazil,620342,"Trousers, bib and brace overalls, breeches and shorts; men's or boys', of cotton (not knitted or crocheted)",units,82954.229,39973.1,1381925.52,1355360.43
2023,Paraguay,imported_from,Brazil,620343,"Trousers, bib and brace overalls, breeches and shorts; men's or boys', of synthetic fibres (not knitted or crocheted)",units,8857.929,4194.4,155616.34,152319.12
2023,Paraguay,imported_from,Brazil,620349,"Trousers, bib and brace overalls, breeches and shorts; men's or boys', of textile materials (other than wool, fine animal hair, cotton or synthetic fibres), (not knitted or crocheted)",units,10124.503,7408.76,185228.65,180460.52
2023,Paraguay,imported_from,Brazil,620412,"Suits; women's or girls', of cotton (not knitted or crocheted)",units,58.015,39.187,887.94,876.32
2023,Paraguay,imported_from,Brazil,620413,"Suits; women's or girls', of synthetic fibres (not knitted or crocheted)",units,211.946,101.088,4069.1,3988.04
2023,Paraguay,imported_from,Brazil,620419,"Suits; women's or girls', of textile materials n.e.c. in item no. 6204.1 (not knitted or crocheted)",units,242.047,25.478,5937.29,5839.68
2023,Paraguay,imported_from,Brazil,620421,"Ensembles; women's or girls', of wool or fine animal hair (not knitted or crocheted)",,0.0,42.0,4201.12,4139.61
2023,Paraguay,imported_from,Brazil,620422,"Ensembles; women's or girls', of cotton (not knitted or crocheted)",units,4210.824,1068.39,44520.13,43572.67
2023,Paraguay,imported_from,Brazil,620423,"Ensembles; women's or girls', of synthetic fibres (not knitted or crocheted)",units,7032.533,1224.09,72544.96,71076.03
2023,Paraguay,imported_from,Brazil,620429,"Ensembles; women's or girls', of textile materials n.e.c. in item no. 6204.2 (not knitted or crocheted)",units,4131.551,1255.42,48953.01,47955.75
2023,Paraguay,imported_from,Brazil,620431,"Jackets and blazers; women's or girls', of wool or fine animal hair (not knitted or crocheted)",,0.0,12.245,1434.92,1414.53
2023,Paraguay,imported_from,Brazil,620432,"Jackets and blazers; women's or girls', of cotton (not knitted or crocheted)",units,3249.45,2068.69,89899.84,88006.97
2023,Paraguay,imported_from,Brazil,620433,"Jackets and blazers; women's or girls', of synthetic fibres (not knitted or crocheted)",units,6331.221,2724.87,152693.25,149467.98
2023,Paraguay,imported_from,Brazil,620439,"Jackets and blazers; women's or girls', of textile materials n.e.c. in item no. 6204.3 (not knitted or crocheted)",units,2067.089,702.556,62026.81,60592.23
2023,Paraguay,imported_from,Brazil,620441,"Dresses; women's or girls', of wool or fine animal hair (not knitted or crocheted)",units,0.019,1.0,10.14,9.9
2023,Paraguay,imported_from,Brazil,620442,"Dresses; women's or girls', of cotton (not knitted or crocheted)",units,16632.857,9977.25,316880.54,309459.31
2023,Paraguay,imported_from,Brazil,620443,"Dresses; women's or girls', of synthetic fibres (not knitted or crocheted)",units,13996.499,4725.33,311326.09,304992.55
2023,Paraguay,imported_from,Brazil,620444,"Dresses; women's or girls', of artificial fibres (not knitted or crocheted)",units,33668.969,13676.2,604499.07,584122.52
2023,Paraguay,imported_from,Brazil,620449,"Dresses; women's or girls', of textile materials n.e.c. in item no. 6204.4 (not knitted or crocheted)",,0.0,5564.34,171644.55,167058.86
2023,Paraguay,imported_from,Brazil,620452,"Skirts and divided skirts; women's or girls', of cotton (not knitted or crocheted)",units,9299.779,5803.09,117698.57,114985.57
2023,Paraguay,imported_from,Brazil,620453,"Skirts and divided skirts; women's or girls', of synthetic fibres (not knitted or crocheted)",units,5632.796,2097.12,65403.97,63957.14
2023,Paraguay,imported_from,Brazil,620459,"Skirts and divided skirts; women's or girls', of textile materials n.e.c. in item no. 6204.5 (not knitted or crocheted)",units,6100.903,3746.76,77206.26,74972.85
2023,Paraguay,imported_from,Brazil,620461,"Trousers, bib and brace overalls, breeches and shorts; women's or girls', of wool or fine animal hair (not knitted or crocheted)",,0.0,173.735,2644.81,2606.04
2023,Paraguay,imported_from,Brazil,620462,"Trousers, bib and brace overalls, breeches and shorts; women's or girls', of cotton (not knitted or crocheted)",units,155987.048,45189.48,2049806.42,2009311.52
2023,Paraguay,imported_from,Brazil,620463,"Trousers, bib and brace overalls, breeches and shorts; women's or girls', of synthetic fibres (not knitted or crocheted)",units,33354.151,7657.93,415537.24,405364.05
2023,Paraguay,imported_from,Brazil,620469,"Trousers, bib and brace overalls, breeches and shorts; women's or girls', of textile materials (other than wool, fine animal hair, cotton or synthetic fibres), (not knitted or crocheted)",units,56670.088,20325.28,737229.652,716513.42
2023,Paraguay,imported_from,Brazil,620520,"Shirts; men's or boys', of cotton (not knitted or crocheted)",units,28851.96,7098.09,443735.22,433665.97
2023,Paraguay,imported_from,Brazil,620530,"Shirts; men's or boys', of man-made fibres (not knitted or crocheted)",units,7052.761,2127.89,83524.56,81811.52
2023,Paraguay,imported_from,Brazil,620590,"Shirts; men's or boys', of textile materials n.e.c. in heading no. 6205 (not knitted or crocheted)",units,3416.394,1207.74,57000.47,55930.27
2023,Paraguay,imported_from,Brazil,620610,"Blouses, shirts and shirt-blouses; women's or girls', of silk or silk waste (not knitted or crocheted)",,0.0,1042.31,10415.42,10227.09
2023,Paraguay,imported_from,Brazil,620620,"Blouses, shirts and shirt-blouses; women's or girls', of wool or fine animal hair (not knitted or crocheted)",,0.0,144.661,3114.33,3030.72
2023,Paraguay,imported_from,Brazil,620630,"Blouses, shirts and shirt-blouses; women's or girls', of cotton (not knitted or crocheted)",units,30278.988,9018.52,388625.28,380015.35
2023,Paraguay,imported_from,Brazil,620640,"Blouses, shirts and shirt-blouses; women's or girls', of man-made fibres (not knitted or crocheted)",units,153043.55,42903.1,1572497.83,1544165.51
2023,Paraguay,imported_from,Brazil,620690,"Blouses, shirts and shirt-blouses; women's or girls', of textile materials n.e.c. in heading no. 6206 (not knitted or crocheted)",units,15446.866,8465.2,225883.91,221005.08
2023,Paraguay,imported_from,Brazil,620711,"Underpants and briefs; men's or boys', of cotton (not knitted or crocheted)",units,912.714,393.734,3515.03,3467.0
2023,Paraguay,imported_from,Brazil,620722,"Nightshirts and pyjamas; men's or boys', of man-made fibres (not knitted or crocheted)",units,19.328,4.46,115.78,104.05
2023,Paraguay,imported_from,Brazil,620729,"Nightshirts and pyjamas; men's or boys', of textile materials other than cotton or man-made fibres (not knitted or crocheted)",,0.0,1250.0,1220.65,1205.1
2023,Paraguay,imported_from,Brazil,620791,"Singlets and other vests, bathrobes, dressing gowns and similar articles; men's or boys', of cotton (not knitted or crocheted)",kg,1586.72,1586.72,11806.92,11408.47
2023,Paraguay,imported_from,Brazil,620799,"Singlets and other vests, bathrobes, dressing gowns and similar articles; men's or boys', of textile materials other than cotton (not knitted or crocheted)",kg,14.742,14.742,692.13,673.2
2023,Paraguay,imported_from,Brazil,620819,"Slips and petticoats; women's or girls', of textile materials other than man-made fibres (not knitted or crocheted)",units,0.751,3.25,14.1,8.0
2023,Paraguay,imported_from,Brazil,620821,"Nightdresses and pyjamas; women's or girls', of cotton (not knitted or crocheted)",units,308.628,291.707,2413.12,2378.45
2023,Paraguay,imported_from,Brazil,620822,"Nightdresses and pyjamas; women's or girls', of man-made fibres (not knitted or crocheted)",units,5512.346,272.34,40641.42,39520.39
2023,Paraguay,imported_from,Brazil,620891,"Singlets and other vests, briefs, panties, negligees, bathrobes, dressing gowns and similar articles; women's or girls', of cotton (not knitted or crocheted)",kg,5173.07,5173.07,81629.23,78486.77
2023,Paraguay,imported_from,Brazil,620892,"Singlets and other vests, briefs, panties, negligees, bathrobes, dressing gowns etc.; women's or girls', of man-made fibres (not knitted or crocheted), excluding incontinence or other sanitary garments or garment liners of heading no. 96.19",kg,2600.16,2600.16,144148.72,141156.18
2023,Paraguay,imported_from,Brazil,620899,"Singlets and other vests, briefs, panties, negligees, bathrobes, dressing gowns and similar articles; women's or girls', of textile materials other than cotton or man-made fibres (not knitted or crocheted)",kg,29.7,29.7,155.74,153.0
2023,Paraguay,imported_from,Brazil,620920,"Garments and clothing accessories; babies', of cotton (not knitted or crocheted)",kg,9006.27,9006.27,140178.06,137235.77
2023,Paraguay,imported_from,Brazil,620930,"Garments and clothing accessories; babies', of synthetic fibres (not knitted or crocheted)",kg,1675.79,1675.79,30995.4,30400.76
2023,Paraguay,imported_from,Brazil,620990,"Garments and clothing accessories; babies', of textile materials other than cotton or synthetic fibres (not knitted or crocheted)",kg,1492.26,1492.26,21366.94,20728.56
2023,Paraguay,imported_from,Brazil,621010,Garments; of felt or non-wovens (not knitted or crocheted),kg,2851.77,2851.77,63975.9,59856.32
2023,Paraguay,imported_from,Brazil,621020,"Garments; overcoats, raincoats, car-coats, capes, cloaks, anoraks (including ski-jackets) and similar articles, men's or boys', of the fabrics of heading no. 5602, 5603, 5903, 5906 or 5907 (not knitted or crocheted)",units,70.444,84.0,2782.69,2745.98
2023,Paraguay,imported_from,Brazil,621030,"Garments; overcoats, raincoats, car-coats, capes, cloaks, anoraks (including ski-jackets) and similar articles, women's or girls', of the fabrics of heading no. 5602, 5603, 5903, 5906 or 5907 (not knitted or crocheted)",units,48.187,14.228,1493.71,1435.92
2023,Paraguay,imported_from,Brazil,621040,"Garments; men's or boys', n.e.c. in item no. 6210.2, of the fabrics of heading no. 5602, 5603, 5903, 5906 or 5907 (not knitted or crocheted)",kg,1078.64,1078.64,18990.67,18682.86
2023,Paraguay,imported_from,Brazil,621050,"Garments; women's or girls', n.e.c. in item no. 6210.3, of the fabrics of heading no. 5602, 5603, 5903, 5906 or 5907 (not knitted or crocheted)",kg,423.87,423.87,51822.12,50613.54
2023,Paraguay,imported_from,Brazil,621111,"Swimwear; men's or boys', (not knitted or crocheted)",units,2990.454,226.488,29956.06,29336.32
2023,Paraguay,imported_from,Brazil,621112,"Swimwear; women's or girls', (not knitted or crocheted)",units,5223.424,481.391,57357.584,56503.04
2023,Paraguay,imported_from,Brazil,621120,Ski suits; (not knitted or crocheted),units,142.96,124.154,6500.9,6026.11
2023,Paraguay,imported_from,Brazil,621132,"Track suits and other garments n.e.c.; men's or boys', of cotton (not knitted or crocheted)",kg,850.545,850.545,24914.98,24332.63
2023,Paraguay,imported_from,Brazil,621133,"Track suits and other garments n.e.c.; men's or boys', of man-made fibres (not knitted or crocheted)",kg,237.914,237.914,9363.62,9163.97
2023,Paraguay,imported_from,Brazil,621139,"Track suits and other garments n.e.c.; men's or boys', of textile materials n.e.c. in item no. 6211.3 (not knitted or crocheted)",kg,9971.5,9971.5,86980.56,84049.63
2023,Paraguay,imported_from,Brazil,621142,"Track suits and other garments n.e.c.; women's or girls', of cotton (not knitted or crocheted)",kg,1872.95,1872.95,60937.298,60008.13
2023,Paraguay,imported_from,Brazil,621143,"Track suits and other garments n.e.c.; women's or girls', of man-made fibres (not knitted or crocheted)",kg,2008.91,2008.91,40278.8,39443.88
2023,Paraguay,imported_from,Brazil,621149,"Track suits and other garments n.e.c.; women's or girls', of textile materials n.e.c. in item no. 6211.4 (not knitted or crocheted)",kg,2575.61,2575.61,11661.81,11417.54
2023,Paraguay,imported_from,Brazil,621210,Brassieres; whether or not knitted or crocheted,kg,35515.6,35515.6,2120744.24,2079187.86
2023,Paraguay,imported_from,Brazil,621220,Girdles and panty-girdles; whether or not knitted or crocheted,kg,5283.19,5283.19,219427.5,207895.92
2023,Paraguay,imported_from,Brazil,621230,Corselettes; whether or not knitted or crocheted,kg,3158.05,3158.05,247951.36,242432.43
2023,Paraguay,imported_from,Brazil,621290,"Braces, suspenders, garters and similar articles; whether or not knitted or crocheted, n.e.c. in heading no. 6212",kg,36345.88,36345.88,1713963.62,1681719.61
2023,Paraguay,imported_from,Brazil,621320,Handkerchiefs; of cotton (not knitted or crocheted),kg,0.48,0.48,24.57,23.95
2023,Paraguay,imported_from,Brazil,621390,Handkerchiefs; of textile materials other than cotton (not knitted or crocheted),kg,6.34,6.34,4315.9,4240.0
2023,Paraguay,imported_from,Brazil,621430,"Shawls, scarves, mufflers, mantillas, veils and the like; of synthetic fibres (not knitted or crocheted)",units,2677.581,180.286,8127.49,7960.09
2023,Paraguay,imported_from,Brazil,621440,"Shawls, scarves, mufflers, mantillas, veils and the like; of artificial fibres (not knitted or crocheted)",,0.0,5.32,499.24,492.87
2023,Paraguay,imported_from,Brazil,621490,"Shawls, scarves, mufflers, mantillas, veils and the like; of textile materials n.e.c. in heading no. 6214 (not knitted or crocheted)",units,410.769,137.434,2080.81,2005.11
2023,Paraguay,imported_from,Brazil,621520,"Ties, bow ties and cravats; of man-made fibres (not knitted or crocheted)",kg,17.868,17.868,976.69,941.11
2023,Paraguay,imported_from,Brazil,621590,"Ties, bow ties and cravats; of textile materials other than silk or man-made fibres (not knitted or crocheted)",kg,42.45,42.45,2597.68,2552.0
2023,Paraguay,imported_from,Brazil,621600,"Gloves, mittens and mitts (not knitted or crocheted)",kg,268.548,268.548,9298.53,8900.32
2023,Paraguay,imported_from,Brazil,621710,Clothing accessories; other than those of heading no. 6212 (not knitted or crocheted),kg,2615.26,2615.26,85257.26,81658.06
2023,Paraguay,imported_from,Brazil,621790,"Clothing; parts of garments or of clothing accessories, other than those of heading no. 6212 (not knitted or crocheted)",kg,1672.84,1672.84,18561.64,17979.18
2023,Paraguay,imported_from,Brazil,630110,Blankets; electric,units,93.512,539.67,1757.73,1683.98
2023,Paraguay,imported_from,Brazil,630130,Blankets (other than electric blankets) and travelling rugs; of cotton,kg,3957.68,3957.68,42310.51,40842.05
2023,Paraguay,imported_from,Brazil,630140,Blankets (other than electric blankets) and travelling rugs; of synthetic fibres,kg,92868.5,92868.5,438803.66,416170.91
2023,Paraguay,imported_from,Brazil,630190,Blankets and travelling rugs; n.e.c. in heading no. 6301,kg,1713.8,1713.8,15474.86,14963.77
2023,Paraguay,imported_from,Brazil,630210,Bed linen; knitted or crocheted,kg,15380.19,15380.19,139916.82,136947.77
2023,Paraguay,imported_from,Brazil,630221,"Bed linen; of cotton, printed, not knitted or crocheted",kg,17312.8,17312.8,188099.5,179718.38
2023,Paraguay,imported_from,Brazil,630222,"Bed linen; of man-made fibres, printed, not knitted or crocheted",kg,101630.0,101630.0,774445.68,748841.01
2023,Paraguay,imported_from,Brazil,630229,"Bed linen; of textile materials (other than cotton or man-made fibres), printed, not knitted or crocheted",kg,386.435,386.435,3944.22,3883.31
2023,Paraguay,imported_from,Brazil,630231,"Bed linen; of cotton (not printed, knitted or crocheted)",kg,11570.7,11570.7,123797.12,119270.88
2023,Paraguay,imported_from,Brazil,630232,"Bed linen; of man-made fibres (not printed, knitted or crocheted)",kg,53135.9,53135.9,385372.85,372899.29
2023,Paraguay,imported_from,Brazil,630239,"Bed linen; of textile materials other than cotton or man-made fibres (not printed, knitted or crocheted)",kg,1409.47,1409.47,26213.69,25487.52
2023,Paraguay,imported_from,Brazil,630240,Table linen; knitted or crocheted,kg,505.168,505.168,3978.89,3856.23
2023,Paraguay,imported_from,Brazil,630251,"Table linen; of cotton, not knitted or crocheted",kg,6991.42,6991.42,56182.55,54270.65
2023,Paraguay,imported_from,Brazil,630253,"Table linen; of man-made fibres, not knitted or crocheted",kg,2889.52,2889.52,28275.21,27212.05
2023,Paraguay,imported_from,Brazil,630259,"Table linen; of textile materials (other than cotton or man-made fibres), not knitted or crocheted",kg,564.759,564.759,10363.57,9527.94
2023,Paraguay,imported_from,Brazil,630260,"Kitchen and toilet linen; of terry towelling or similar terry fabrics, of cotton",kg,356304.7,356304.7,3377270.036,3256755.31
2023,Paraguay,imported_from,Brazil,630291,"Toilet and kitchen linen; of cotton, excluding terry towelling or similar terry fabrics",kg,33806.6,33806.6,295257.0,290940.43
2023,Paraguay,imported_from,Brazil,630293,Toilet and kitchen linen; of man-made fibres,kg,1286.55,1286.55,15032.62,14731.4
2023,Paraguay,imported_from,Brazil,630299,Toilet and kitchen linen; of textile materials (other than cotton or man-made fibres),kg,939.98,939.98,7763.34,7579.03
2023,Paraguay,imported_from,Brazil,630312,"Curtains (including drapes) and interior blinds; curtain or bed valances, knitted or crocheted, of synthetic fibres",kg,6150.46,6150.46,9301.61,9128.18
2023,Paraguay,imported_from,Brazil,630319,"Curtains (including drapes) and interior blinds; curtain or bed valances, knitted or crocheted, of textile materials other than synthetic fibres",kg,411.318,411.318,15000.47,14640.67
2023,Paraguay,imported_from,Brazil,630391,"Curtains (including drapes) and interior blinds, curtain or bed valances; of cotton, not knitted or crocheted",kg,470.42,470.42,3616.22,3484.48
2023,Paraguay,imported_from,Brazil,630392,"Curtains (including drapes) and interior blinds, curtain or bed valances; of synthetic fibres, not knitted or crocheted",kg,16990.5,16990.5,123973.36,120760.69
2023,Paraguay,imported_from,Brazil,630399,"Curtains (including drapes) and interior blinds, curtain or bed valances; of textile materials other than cotton or synthetic fibres, not knitted or crocheted",kg,7631.06,7631.06,94693.46,92094.54
2023,Paraguay,imported_from,Brazil,630419,Bedspreads; not knitted or crocheted,kg,6055.03,6055.03,25710.7,24752.47
2023,Paraguay,imported_from,Brazil,630420,"Furnishing articles; excluding those of heading no. 9404, bed nets, specified in Subheading Note 1 to this Chapter",kg,95.5,95.5,1163.1,1148.81
2023,Paraguay,imported_from,Brazil,630491,"Furnishing articles; excluding those of heading no. 9404, n.e.c. in heading 6304, knitted or crocheted",kg,502.0,502.0,5543.5,5389.35
2023,Paraguay,imported_from,Brazil,630492,"Furnishing articles; of cotton, not knitted or crocheted (excluding bedspreads and articles of heading no. 9404)",kg,736.6,736.6,4034.69,3719.12
2023,Paraguay,imported_from,Brazil,630493,"Furnishing articles; of synthetic fibres, not knitted or crocheted (excluding bedspreads and articles of heading no. 9404)",kg,6199.19,6199.19,91497.02,89012.91
2023,Paraguay,imported_from,Brazil,630499,"Furnishing articles; of textile materials other than cotton or synthetic fibres, not knitted or crocheted (excluding bedspreads and articles of heading no. 9404)",kg,6242.81,6242.81,4534.66,4323.2
2023,Paraguay,imported_from,Brazil,630510,"Sacks and bags; of a kind used for the packing of goods, of jute or of other textile bast fibres of heading no. 5303",kg,1787.32,1787.32,42592.77,40539.82
2023,Paraguay,imported_from,Brazil,630520,"Sacks and bags; of a kind used for the packing of goods, of cotton",kg,32.9,32.9,249.904,216.43
2023,Paraguay,imported_from,Brazil,630532,"Sacks and bags; of a kind used for the packing of goods, of man-made textile materials, flexible intermediate bulk containers",kg,191655.0,191655.0,926739.34,889018.06
2023,Paraguay,imported_from,Brazil,630533,"Sacks and bags; of a kind used for the packing of goods, of man-made textile materials, of polyethylene or polypropylene strip or the like, not flexible intermediate bulk containers",kg,437126.0,437126.0,822707.89,794864.67
2023,Paraguay,imported_from,Brazil,630539,"Sacks and bags; of a kind used for the packing of goods, of man-made textile materials, not of polyethylene or polypropylene strip or the like, not flexible intermediate bulk containers",kg,76.2,76.2,341.16,328.0
2023,Paraguay,imported_from,Brazil,630590,"Sacks and bags; of a kind used for the packing of goods, of textile materials (other than jute, cotton or man-made textile materials)",kg,8169.48,8169.48,30049.72,29630.45
2023,Paraguay,imported_from,Brazil,630612,"Tarpaulins, awnings and sunblinds; of synthetic fibres",kg,166125.0,166125.0,680228.25,660910.07
2023,Paraguay,imported_from,Brazil,630619,"Tarpaulins, awnings and sunblinds; of textile materials other than synthetic fibres",kg,31403.5,31403.5,193452.21,187005.52
2023,Paraguay,imported_from,Brazil,630622,Tents (including temporary canopies and similar articles); of synthetic fibres,kg,2526.98,2526.98,53921.64,48800.38
2023,Paraguay,imported_from,Brazil,630629,Tents (including temporary canopies and similar articles); of textile materials other than synthetic fibres,kg,17671.7,17671.7,243884.21,237586.15
2023,Paraguay,imported_from,Brazil,630690,"Camping goods; (of textile materials), n.e.c in heading no. 6306",kg,2700.24,2700.24,20445.9,20057.09
2023,Paraguay,imported_from,Brazil,630710,"Cloths; floor cloths, dish-cloths, dusters and similar cleaning cloths",kg,91191.15,91191.15,341755.84,323140.29
2023,Paraguay,imported_from,Brazil,630720,Life-jackets and life-belts,kg,4782.59,4782.59,115866.71,113403.94
2023,Paraguay,imported_from,Brazil,630790,"Textiles; made up articles (including dress patterns), n.e.c. in chapter 63, n.e.c. in heading no. 6307",kg,32518.816,32518.816,371439.39,360279.27
2023,Paraguay,imported_from,Brazil,630800,"Fabrics, woven and yarn; in sets, whether or not with accessories, for making up into rugs, tapestries, embroidered table cloths or serviettes or similar textile articles, packaged for retail sale",kg,6234.7,6234.7,3494.67,3432.9
2023,Paraguay,imported_from,Brazil,630900,"Clothing; worn, and other worn articles",kg,232.2,232.2,3054.716,645.59
2023,Paraguay,imported_from,Brazil,631090,"Rags; used or new, scrap twine, cordage, rope and cables and worn out articles of twine, cordage, rope or cables, of textile materials; other than sorted",kg,1981.27,1981.27,9317.35,9038.34
2023,Paraguay,imported_from,Brazil,640110,"Footwear; waterproof with metal toe-cap, rubber or plastic outer soles and uppers (not assembled by stitch, rivet, nail, screw, plug or similar)",pairs_of_units,1269.521,9811.72,36086.97,34881.29
2023,Paraguay,imported_from,Brazil,640192,"Footwear; waterproof, covering the ankle (but not the knee), rubber or plastic outer soles and uppers (not assembled by stitch, rivet, nail, screw, plug or similar)",pairs_of_units,66497.716,295767.0,883447.31,843800.36
2023,Paraguay,imported_from,Brazil,640199,"Footwear; waterproof, n.e.c. in heading no. 6401, rubber or plastic outer soles and uppers (not assembled by stitch, rivet, nail, screw, plug or similar)",pairs_of_units,11160.933,18059.0,188495.6,181661.34
2023,Paraguay,imported_from,Brazil,640219,"Sports footwear; (other than ski-boots, snowboard boots or cross-country ski footwear), with outer soles and uppers of rubber or plastics",pairs_of_units,56854.219,103706.3,1754876.0,1718704.74
2023,Paraguay,imported_from,Brazil,640220,"Footwear; with outer soles and uppers of rubber or plastics, upper straps or thongs assembled to the sole by plugs",pairs_of_units,1989732.608,1945890.0,10552256.94,10215180.65
2023,Paraguay,imported_from,Brazil,640291,"Footwear; n.e.c. in heading no. 6402, covering the ankle, with outer soles and uppers of rubber or plastics",pairs_of_units,130076.056,129077.053,2774277.69,2733090.78
2023,Paraguay,imported_from,Brazil,640299,"Footwear; n.e.c. in heading no. 6402, (other than just covering the ankle), with outer soles and uppers of rubber or plastics",pairs_of_units,1054940.019,1014157.437,15514314.1,15262312.16
